"workstream","startup_id","startup_name","scope_decision","current_theme","quality_band","review_status","source_type","source_url","summary_words","data_quality_score_10","action","reason","effort","expected_impact","current_summary"
"semantic_conflict_batch","notfossil","NotFossil","include","bioremediation and microbial resource recovery","high","reviewed","official_portfolio_profile","https://sf500.com.ar/","50","8.5","enrich_or_reclassify_semantic_fit","Semantic confidence low with margin 1.2; current theme: therapeutics and regenerative bio","medium","medium","NotFossil develops biofilters that use proprietary microorganisms to degrade hydrocarbons. The company is a clear biological remediation case: it applies microbial metabolism to reduce fossil contamination and recover environmental function. It belongs inside BIO VC LATAM as a bioremediation and planetary-boundary startup, not as ag intelligence or generic climate software."
"semantic_conflict_batch","heartbest","Heartbest","include","food transition ingredients and proteins","high","reviewed","official_portfolio_profile","https://theyieldlablatam.com/companies/heartbest/","59","8.5","enrich_or_reclassify_semantic_fit","Semantic confidence low with margin 0.5; current theme: agri intelligence and traceable markets","medium","medium","Heartbest is a Mexican foodtech company producing plant-based dairy alternatives such as cheese, milk and spreads. Its products are built directly from plants to offer healthier and more sustainable alternatives to animal dairy systems. It belongs inside BIO VC LATAM as food transition infrastructure: not deep biotech, but a material shift from livestock-based dairy to biobased consumer food systems."
"semantic_conflict_batch","agroforte","Agroforte","include","traceability and tokenized resource infrastructure","high","reviewed","official_portfolio_profile","https://theyieldlablatam.com/companies/agroforte/","61","8.5","enrich_or_reclassify_semantic_fit","Semantic confidence low with margin 1.2; current theme: agri intelligence and traceable markets","medium","medium","Brazilian rural-finance platform building a digital bank for small and medium poultry, pork and dairy producers. It uses historical production data from integrated animal-protein systems to manage credit risk and finance infrastructure and operational improvements. It remains an edge include because the mechanism is fintech, but the use case is tightly coupled to animal health, welfare, supply-chain resilience and livestock production."
"semantic_conflict_batch","inprenha","Inprenha","include","ag biologicals and crop resilience","medium","reviewed","official_portfolio_profile","https://www.spventures.com.br/","60","8","enrich_or_reclassify_semantic_fit","Semantic confidence low with margin 3.3; current theme: agri intelligence and traceable markets","medium","medium","Brazilian animal-reproduction biotechnology company developing a protein-based technology intended to increase pregnancy rates in mammals. The available source is still a fund portfolio signal rather than a detailed company website, but the mechanism and market are clearly biological: fertility, livestock reproduction and animal productivity. It belongs inside BIO VC LATAM as animal biotech for reproductive efficiency in living production systems."
"semantic_conflict_batch","calice","Calice","include","precision agriculture intelligence","medium","reviewed","official_website","https://calice.ai/eng/","60","8","enrich_or_reclassify_semantic_fit","Semantic confidence low with margin 0.2; current theme: grain traceability and producer infrastructure","medium","medium","Calice is an Argentine agtech platform that models interactions between genotype, environment and management to run virtual agronomic trials and predict product performance. Its environmental fingerprints and simulation tools help seed, biological-input and fertilizer companies place products in the right field conditions faster and with fewer physical trials. It belongs inside BIO VC LATAM as precision-ag and ag-input intelligence infrastructure."
"semantic_conflict_batch","logshare","LogShare","include","low-emission logistics and supply-chain efficiency","high","reviewed","official_website","https://www.logshare.com.br/embarcadores?lang=en","58","8.5","enrich_or_reclassify_semantic_fit","Semantic confidence low with margin 1.2; current theme: ag biologicals and crop resilience","medium","medium","LogShare is a Brazilian collaborative logistics platform that matches freight capacity, return routes and shipper demand to reduce empty trips, transport costs and avoidable emissions. Its system adds monitoring, traceability and CO2 analytics to cargo operations. It is a border case for BIO VC LATAM, included as planetary-boundary infrastructure for material supply-chain efficiency rather than as bio-based technology."
"semantic_conflict_batch","seedmatriz","SeedMatriz","include","seed technology and crop establishment","high","reviewed","official_website","https://seedmatriz.com/en/","49","9","enrich_or_reclassify_semantic_fit","Semantic confidence low with margin 2.2; current theme: grain traceability and producer infrastructure","medium","medium","SeedMatriz is an Argentine seed-technology company developing seed encapsulation and real-time agronomy tools to improve seed uniformity, nutrition, protection and field performance. Its approach intervenes directly in crop establishment by combining seed treatment, agronomic data and performance-enhancing coatings. It belongs inside BIO VC LATAM as seed-system and crop-resilience infrastructure."
"semantic_conflict_batch","horus_aeronaves","Horus Aeronaves","include","drone-enabled remote sensing and field intelligence","medium","reviewed","secondary_public_profile","https://www.lavca.org/sp-ventures-invests-r3m-in-horus-aeronaves-em-portugues/","55","8","enrich_or_reclassify_semantic_fit","Semantic confidence low with margin 2.3; current theme: food ingredients and biofactories","medium","medium","Horus Aeronaves is a Brazilian drone and aerial-mapping company developing UAVs, sensors and image-processing products for agriculture. Public investment coverage describes its focus on mapping farmland, generating agronomic imagery and expanding agriculture-oriented products. It belongs inside BIO VC LATAM as precision-ag remote-sensing infrastructure for crop monitoring and resource-efficient field decisions, not food ingredients or biomanufacturing."
"semantic_conflict_batch","agrojusto","Agrojusto","include","agri-market and traceability infrastructure","high","reviewed","official_website","https://agrojustoinc.com/","55","9","enrich_or_reclassify_semantic_fit","Semantic confidence low with margin 3.1; current theme: agri intelligence and traceable markets","medium","medium","Agrojusto is an Argentine digital infrastructure platform for small producers, local food systems and territorial value chains. Its tools support traceability, producer digitization, market access and coordination between public agencies, buyers and food producers. It belongs inside BIO VC LATAM as food-system market infrastructure directly coupled to material agricultural supply chains, not as generic software."
"semantic_conflict_batch","splight","Splight","include","AI grid optimization and renewable integration","high","reviewed","official_website","https://content.splight-ai.com/blog/ai-powered-grids-the-future-of-efficient-renewable-energy","47","9","enrich_or_reclassify_semantic_fit","Semantic confidence low with margin 0.6; current theme: ag biologicals and crop resilience","medium","medium","Splight is a climate-tech company using AI to optimize electric grids, renewable-energy forecasting, DERMS, congestion management and grid resilience. It is outside narrow bio-based technology, but fits the planetary-boundary perimeter as clean-energy infrastructure. It should cluster with climate and resource intelligence, not agri intelligence or traceable markets."
"semantic_conflict_batch","michroma","Michroma","include","fermented functional ingredients","high","reviewed","official_website","https://www.michroma.co/","67","9","enrich_or_reclassify_semantic_fit","Semantic confidence low with margin 0.9; current theme: biomanufacturing and molecular platforms","medium","medium","Michroma is an Argentina/US food-biotech company creating next-generation natural ingredients using fungal synthetic biology and precision fermentation. Its platform engineers fungi as industrial biofactories to produce stable, vibrant natural colors, flavors and antioxidant ingredients; Red+ is positioned as a pH-stable, heat-resistant natural red colorant for multiple food categories. It belongs inside BIO VC LATAM as precision-fermented food ingredients and biomanufacturing infrastructure replacing petroleum- or crop-derived colorants."
"semantic_conflict_batch","bemagro","BemAgro","include","precision agriculture intelligence","medium","reviewed","official_website","https://www.bemagro.cloud/en/index.html","61","8","enrich_or_reclassify_semantic_fit","Semantic confidence low with margin 2.1; current theme: resource recovery and remediation","medium","medium","BemAgro is a Brazilian precision-agriculture SaaS company using AI, drone imagery, machinery vectors and cloud geospatial processing to support crop management from planting to harvest. Its modules process field images, detect weeds, simulate planting lines, generate variable-rate zones, restore crop rows, detect planting failures and count plants. It belongs inside BIO VC LATAM as field-intelligence infrastructure for productive and resource-efficient agriculture."
"semantic_conflict_batch","multiplai_health","MultiplAI Health","include","transcriptomic screening and precision diagnostics","high","reviewed","official_website","https://www.multiplaihealth.com/","57","8.5","enrich_or_reclassify_semantic_fit","Semantic confidence low with margin 2.2; current theme: therapeutics and regenerative bio","medium","medium","MultiplAI Health is an Argentina/UK preventive-medicine biotech using whole-blood RNA sequencing and AI to screen cardiovascular and other complex diseases remotely. The company positions its platform as a low-cost, blood-based transcriptomic test combined with machine learning for earlier risk detection and scalable preventive care. It belongs inside BIO VC LATAM as genomic diagnostics and precision-health infrastructure."
"semantic_conflict_batch","nat4bio","Nat4Bio","include","edible coatings and post-harvest biopreservation","high","reviewed","official_website","https://www.nat4bio.com/","57","9","enrich_or_reclassify_semantic_fit","Semantic confidence low with margin 2.3; current theme: drug discovery and disease therapeutics","medium","medium","Nat4Bio is an Argentine food-protection biotech developing nature-inspired, cell-free biological formulations and edible coatings that extend fresh-produce shelf life and reduce post-harvest waste. Its pipeline uses native microorganisms, microbial biopolymers, natural antimicrobials and food-grade excipients to protect citrus, avocados, apples, pears and other crops. It should cluster with food biotech, post-harvest preservation, edible coatings and food-loss reduction."
"semantic_conflict_batch","asclepii","Asclepii","include","regenerative wound care and tissue repair","medium","reviewed","official_website","https://asclepii.com/","59","8","enrich_or_reclassify_semantic_fit","Semantic confidence low with margin 2.5; current theme: therapeutics and regenerative bio","medium","medium","Asclepii is a regenerative-medicine company developing wound-care technologies between basic bandages and complex cell therapies. Its Artemis tissue-regeneration matrix and Poseidon nanosilver hydrogel wound dressing are clinical wound-healing products for tissue repair, infection control and modern wound management. It is not a food-ingredient or cosmetic case; it should cluster with regenerative medicine, wound care, tissue repair and clinical biomaterials."
"semantic_conflict_batch","outpost","Outpost","include","microbiome predictive biology and techbio","medium","reviewed","official_website","https://www.outpost.bio/","61","8","enrich_or_reclassify_semantic_fit","Semantic confidence low with margin 2.7; current theme: therapeutics and regenerative bio","medium","medium","Outpost is a TechBio company making human microbiology computable by pairing wet-lab microbiology with machine learning and foundation-model style predictive systems. Its closed-loop engine is aimed at microbiome R&D, predictive medicine and biotech or consumer-health product development. It is not a clinical medical device or diagnostics product; it should cluster with computational biology, microbiome modeling, predictive biology and life-science software."
"semantic_conflict_batch","sensix","Sensix","include","precision agriculture and soil intelligence","medium","reviewed","official_website","https://sensix.ag/","54","8","enrich_or_reclassify_semantic_fit","Semantic confidence low with margin 3.2; current theme: ag biologicals and crop resilience","medium","medium","Sensix is a Brazilian decision-agriculture platform that combines remote sensing, soil data, productivity maps, climate information and AI to turn field data into crop-management decisions. Its products support field scanning, productivity-gap detection, variable-rate prescriptions and input-efficiency planning. It belongs inside BIO VC LATAM as precision-agriculture infrastructure for resource-efficient crop production, not as biological inputs."
"semantic_conflict_batch","zavia_bio","Zavia Bio","include","ag biologicals and crop resilience","high","reviewed","external_profile","https://www.f6s.com/company/zavia-bio","59","9","enrich_or_reclassify_semantic_fit","Semantic confidence medium with margin 7.6; current theme: grain traceability and producer infrastructure","medium","medium","Zavia Bio is an Argentine ag-biotech startup developing biological agro-inputs for more resilient and sustainable agriculture. Public profiles describe designer proteins and peptides that activate natural plant mechanisms at very low concentrations, using synthetic biology, AI and fermentation to address problems conventional agrochemicals have not solved. It belongs inside BIO VC LATAM as ag biologicals and biomolecule-based crop-resilience infrastructure."
"semantic_conflict_batch","cellco","CellCo","include","therapeutic and regenerative biology","medium","reviewed","linkedin_company_profile","https://www.linkedin.com/company/the-cellco","32","8","enrich_or_reclassify_semantic_fit","Semantic confidence medium with margin 8.8; current theme: agri intelligence and traceable markets","medium","medium","Startup therapeutics que combina biología sintética, IA y datos sintéticos para diseñar medicinas de nueva generación en dominios biológicos complejos y escasos en datos. Entra en tesis por therapeutics and regenerative medicine."
"semantic_conflict_batch","geoprot","Geoprot","include","protein biology and scientific infrastructure","high","reviewed","official_portfolio_profile","https://www.gridexponential.com/portfolio","61","8.5","enrich_or_reclassify_semantic_fit","Semantic confidence medium with margin 7.3; current theme: agri intelligence and traceable markets","medium","medium","Geoprot is a GRIDX portfolio deep-biotech startup developing a non-AI method for protein function analysis and prediction. Public GRIDX portfolio pages classify Geoprot under Deep-biotech and describe the company as a revolutionary approach to understanding and predicting protein function. It belongs inside BIO VC LATAM as scientific infrastructure for protein biology and biotech R&D, not as a crop-protection bioinput company."
"semantic_conflict_batch","tbit","TBIT","include","seed and grain quality intelligence","medium","reviewed","official_portfolio_profile","https://www.kptl.com.br/portfolio/tbit/","52","8","enrich_or_reclassify_semantic_fit","Semantic confidence medium with margin 8.4; current theme: agri intelligence and traceable markets","medium","medium","TBIT is a Brazilian agtech replacing manual seed and grain analysis with digital image processing and AI. The technology supports objective quality evaluation for seed companies, grain handlers and agricultural supply chains. It belongs inside BIO VC LATAM as crop-input and grain-quality intelligence: software and vision models applied to biological agricultural materials."
"semantic_conflict_batch","libera","Libera","include","therapeutic and regenerative biology","high","reviewed","official_portfolio_profile","https://sf500.com.ar/","18","8.5","enrich_or_reclassify_semantic_fit","Semantic confidence medium with margin 8.5; current theme: drug discovery and disease therapeutics","medium","medium","Startup therapeutics que usa vesiculas extracelulares para combatir enfermedades inflamatorias. Entra en tesis por therapeutics and regenerative medicine."
"semantic_conflict_batch","dogma_biotech","Dogma Biotech","include","therapeutic and regenerative biology","high","reviewed","official_portfolio_profile","https://www.gridexponential.com/portfolio","24","8.5","enrich_or_reclassify_semantic_fit","Semantic confidence medium with margin 8.7; current theme: drug discovery and disease therapeutics","medium","medium","Startup therapeutics que usa IA y azucares descubiertos computacionalmente para mejorar la eficacia de tratamientos biologicos. Entra en tesis por therapeutics and regenerative medicine."
"semantic_conflict_batch","produzindo-certo","Produzindo Certo","include","traceability and tokenized resource infrastructure","medium","reviewed","official_portfolio_listing","https://theyieldlablatam.com/portfolio/","23","8","enrich_or_reclassify_semantic_fit","Semantic confidence medium with margin 10.1; current theme: agri intelligence and traceable markets","medium","medium","Plataforma brasilena de transparencia, trazabilidad y cumplimiento socioambiental para cadenas agroindustriales. Entra por infraestructura material de gobernanza y verificacion sobre produccion agropecuaria real."
"semantic_conflict_batch","algalife","Algalife","include","microalgae bioprocess platforms","medium","reviewed","official_portfolio_profile","https://www.gridexponential.com/portfolio","25","8","enrich_or_reclassify_semantic_fit","Semantic confidence medium with margin 10.8; current theme: food ingredients and biofactories","medium","medium","GridX portfolio company building a platform to optimize productive processes based on microalgae. It belongs inside BIO VC LATAM as microalgae bioprocessing and bioindustrial infrastructure."
"semantic_conflict_batch","inceres","InCeres","include","precision agriculture and soil intelligence","medium","reviewed","official_website","https://www.inceres.com.br/","31","8","enrich_or_reclassify_semantic_fit","Semantic confidence medium with margin 5.4; current theme: ag biologicals and crop resilience","medium","medium","Brazilian precision-agriculture platform integrating agricultural information from pre-planting to post-harvest, with AI, soil sampling, satellite monitoring and input-optimization tools. It belongs inside BIO VC LATAM as resource-efficiency infrastructure for crop production."
"semantic_conflict_batch","tracestory","Tracestory","include","climate and resource intelligence platforms","high","reviewed","official_website","https://www.tracestory.com/en/home","25","8.5","enrich_or_reclassify_semantic_fit","Semantic confidence medium with margin 6; current theme: agri intelligence and traceable markets","medium","medium","Infraestructura de trazabilidad colaborativa y pasaporte digital de producto para cadenas agroalimentarias e industriales. Entra en tesis por transparencia y MRV aplicado a cadenas materiales."
"semantic_conflict_batch","ergo_bioscience","Ergo Bioscience","include","food transition ingredients and proteins","high","reviewed","official_website","https://www.ergobiotech.com/who-we-are","29","8.5","enrich_or_reclassify_semantic_fit","Semantic confidence medium with margin 6.4; current theme: drug discovery and disease therapeutics","medium","medium","Startup biotech que usa cultivo de celulas vegetales para desarrollar ingredientes y proteinas sostenibles para alimentos, salud, belleza y agricultura. Entra en tesis por food biotech and novel ingredients."
"semantic_conflict_batch","agrotools","AGROTOOLS","include","precision agriculture intelligence","medium","reviewed","official_website","https://agrotools.com.br/en/","65","8","enrich_or_reclassify_semantic_fit","Semantic confidence medium with margin 7.6; current theme: grain traceability and producer infrastructure","medium","medium","AGROTOOLS is a Brazilian agribusiness intelligence platform connecting land, supply chains and corporate decision-making through geospatial data, risk analytics and ESG/compliance monitoring. Its solutions support rural finance, insurance, sourcing, brand protection, supply-chain intelligence and socioenvironmental monitoring, with more than 1,300 data layers and large-scale territorial analyses. It belongs inside BIO VC LATAM as agri-risk, traceability and planetary-boundary intelligence infrastructure for agricultural value chains."
"semantic_conflict_batch","sima","Sima","include","precision agriculture intelligence","high","reviewed","official_website","https://sima.ag/","28","8.5","enrich_or_reclassify_semantic_fit","Semantic confidence medium with margin 7.9; current theme: agri intelligence and traceable markets","medium","medium","Plataforma de agricultura inteligente para monitoreo de cultivos, geolocalizacion de datos y generacion de ordenes de trabajo en campo. Entra en tesis por precision agriculture and resource intelligence."
"semantic_conflict_batch","levya","Levya","include","food ingredients and biofactories","high","reviewed","official_website","https://levyabio.com/","25","8.5","enrich_or_reclassify_semantic_fit","Semantic confidence medium with margin 8.2; current theme: food ingredients and biofactories","medium","medium","Startup biotech que produce grasas y aceites sostenibles con precision fermentation usando levaduras salvajes no GMO. Entra por food ingredients / biomateriales para alimentos y cosmetica."
"semantic_conflict_batch","cerradox","CerradoX","include","precision agriculture intelligence","medium","reviewed","official_website","https://cerradox.com/","57","8","enrich_or_reclassify_semantic_fit","Semantic confidence medium with margin 8.5; current theme: bioactive products and regenerative edge cases","medium","medium","Brazilian agricultural production platform turning idle or underused land into standardized, traceable, technology-monitored high-value crops, starting with berries and expanding toward cacao and avocado. It combines financing, technical assistance, agronomic monitoring, guaranteed purchase and buyer-side traceability. It belongs inside BIO VC LATAM as material agri-food infrastructure for crop production, land-use intensification, producer income and transparent supply chains."
"semantic_conflict_batch","calfix","Calfix","include","biobased chemistry and materials","high","reviewed","public_company_profile","https://www.linkedin.com/company/calfix-bio","59","8.5","enrich_or_reclassify_semantic_fit","Semantic confidence medium with margin 8.7; current theme: biobased chemistry and circular materials","medium","medium","Calfix is an Argentine biotech-materials startup developing biotechnology solutions for repairing cracks in concrete. The public company profile is still thin, but it specifically positions Calfix Bio around biotech solutions for concrete cracks, making the thesis fit clear: a biological or biomaterial route for construction-material repair. It belongs inside BIO VC LATAM as an early, source-thin biobased construction-materials case."
"semantic_conflict_batch","soygreen","SoyGREEN","include","extremophile microbial ag inputs","medium","reviewed","official_website","https://soygreen.bio/","56","8","enrich_or_reclassify_semantic_fit","Semantic confidence medium with margin 9.7; current theme: ag biologicals and crop resilience","medium","medium","SoyGREEN is an Argentine agricultural-microbiology startup developing biological solutions to mitigate climate change and transform farming. Its official site describes a UNRC and CONICET-UNRC scientific team validating its first bioinput, focused on reducing greenhouse-gas emissions, substituting chemical fertilizers and applying microbiological technologies to agriculture. It belongs inside BIO VC LATAM as ag biologicals and climate-mitigation bioinputs."
"semantic_conflict_batch","hybridon","Hybridon","include","bioactive materials and surface technologies","high","reviewed","official_website_or_public_profile","https://hybridon.com.ar/","81","8.5","enrich_or_reclassify_semantic_fit","Semantic confidence medium with margin 9.8; current theme: therapeutics and regenerative bio","medium","medium","Argentine materials-science startup developing antimicrobial nanotechnology and bioactive surface/material applications. The current evidence is not yet as deep as a full company technical profile, but it is materially closer to the BIO VC LATAM thesis than to generic software: its value proposition is a physical antimicrobial technology for health, textiles or surface-material use cases. It should move from provisional exclude to include-under-review as a bioactive materials and advanced-materials case, with follow-up needed to confirm product maturity and exact biological mechanism."
