"workstream","startup_id","startup_name","scope_decision","current_theme","quality_band","review_status","source_type","source_url","summary_words","data_quality_score_10","action","reason","effort","expected_impact","current_summary"
"semantic_conflict_batch","syocin-biotech","Syocin Biotech","include","ag biologicals and crop resilience","medium","reviewed","official_website","https://syocin.com/","34","8","enrich_or_reclassify_semantic_fit","Semantic confidence medium with margin 10.2; current theme: biomanufacturing and molecular platforms","medium","medium","Startup ag biotech que desarrolla biobactericidas proteicos de alta precision para proteger cultivos frente a fitopatogenos bacterianos sin afectar microbiomas beneficiosos. Entra en tesis por su uso de biologia sintetica aplicada a resiliencia agricola."
"semantic_conflict_batch","HIAMET","HIAMET","include","bioenergy and waste-to-resource systems","medium","reviewed","official_website","https://www.hiamet.com/","53","8","enrich_or_reclassify_semantic_fit","Semantic confidence medium with margin 5.2; current theme: resource recovery and remediation","medium","medium","HIAMET is an Argentine biotech company focused on improving biogas production from organic waste. Its official site describes process and additive design for organic-waste-to-energy conversion, biotech-based solutions for bioenergy and environmental-impact problems, biodigester-performance analysis, pilot-scale validation and custom additive supply. It belongs inside BIO VC LATAM as bioenergy and waste-to-resource infrastructure, not medtech."
"semantic_conflict_batch","sensify","Sensify","include","climate and resource intelligence platforms","high","reviewed","official_website","https://www.sensify.com.ar/","62","8.5","enrich_or_reclassify_semantic_fit","Semantic confidence medium with margin 5.3; current theme: ag biologicals and crop resilience","medium","medium","Sensify is an Argentine IoT and AI platform for commercial refrigeration and cold-chain operations in food and beverages. Its systems connect refrigeration assets, predict operating data and provide business insights to avoid cold-chain outages, reduce food losses, improve asset performance and lower energy use. It belongs inside BIO VC LATAM as food-system resource-efficiency infrastructure, a defensible edge case rather than core biotech."
"semantic_conflict_batch","biometallum","BioMetallum","include","critical materials and resource systems","high","reviewed","official_website","https://bio-metallum.com/","60","8.5","enrich_or_reclassify_semantic_fit","Semantic confidence medium with margin 5.5; current theme: bioactive products and regenerative edge cases","medium","medium","BioMetallum is an Argentine biomining company using microorganisms, synthetic biology and AI-driven exploration to extract lithium and other metals with lower water use, fewer chemicals and reduced environmental impact. It is a high-fit planetary and biobased-industrial case because it applies living systems to critical-mineral extraction for the energy transition. It belongs inside BIO VC LATAM as biomining and resource-recovery infrastructure."
"semantic_conflict_batch","galtec","Galtec Life","include","galectin immunotherapy platforms","high","reviewed","official_website","https://galtec.ar/en/home/","57","8.5","enrich_or_reclassify_semantic_fit","Semantic confidence medium with margin 5.8; current theme: drug discovery and disease therapeutics","medium","medium","Galtec Life is an Argentine biotech developing immunotherapies based on galectin modulation for cancer, autoimmune diseases and chronic inflammatory conditions. The semantic anchor is therapeutic immunology: the company designs biological interventions that act on galectin-mediated immune and inflammatory pathways. It belongs inside BIO VC LATAM as a therapeutic biotech platform, not ag intelligence or generic life-science services."
"semantic_conflict_batch","qnity","Qnity","include","quantum sensing for drug discovery","medium","reviewed","official_website","https://www.qnity.bio/","59","8","enrich_or_reclassify_semantic_fit","Semantic confidence medium with margin 5.9; current theme: therapeutics and regenerative bio","medium","medium","Brazilian molecular-screening company developing a quantum-electrochemical chip for real-time drug discovery and affinity testing across molecule sizes, from small organics to complex biologics. Originating from UNESP research, its device aims to make molecular interaction assays faster, more accessible and more sensitive. It belongs inside BIO VC LATAM as scientific instrumentation for biological binding, drug discovery and pharma R&D."
"semantic_conflict_batch","future_cow","Future Cow","include","precision-fermented dairy proteins","medium","reviewed","official_website","https://www.futurecow.com.br/","56","8","enrich_or_reclassify_semantic_fit","Semantic confidence medium with margin 6; current theme: agri intelligence and traceable markets","medium","medium","Future Cow is a Brazilian food-biotech company producing animal-free dairy proteins through precision fermentation. Its platform uses DNA coding in microbial hosts to produce milk proteins without cows, enabling dairy ingredients with lower animal dependence and potential emissions benefits. It belongs inside BIO VC LATAM as a core food-biotech and alternative-protein company, specifically precision-fermented dairy biofactories."
"semantic_conflict_batch","arqlite","Arqlite","include","circular construction materials from plastic waste","medium","reviewed","secondary_public_profile","https://curbwaste.com/company-profiles-network/arqlite","49","8","enrich_or_reclassify_semantic_fit","Semantic confidence medium with margin 6.2; current theme: biobased materials and waste valorization","medium","medium","Arqlite is a circular-materials company converting hard-to-recycle plastics into low-carbon lightweight aggregates and other materials for construction and manufacturing. It is not biomanufacturing or molecular biotech; it belongs inside the broader BIO VC LATAM perimeter as planetary-boundary circular materials infrastructure that reduces plastic waste and substitutes virgin construction inputs."
"semantic_conflict_batch","frizata","Frizata","include","flexitarian food and alternative protein systems","medium","reviewed","secondary_public_profile","https://latamlist.com/frizata-raises-4-65m-funding-round-for-flexitarian-frozen-meals/","60","8","enrich_or_reclassify_semantic_fit","Semantic confidence medium with margin 6.5; current theme: agri intelligence and traceable markets","medium","medium","Frizata is an Argentine flexitarian frozen-food company producing direct-to-consumer meals, vegetables, appetizers and meatless products across Argentina, Chile and Brazil. Public investment coverage describes proprietary meatless items, preservative-free products and a thesis of helping consumers reduce animal-product dependence through convenient frozen foods. It belongs inside BIO VC LATAM as edge food-transition infrastructure, adjacent to alternative proteins rather than core biotech."
"semantic_conflict_batch","agrosmart","Agrosmart","include","precision agriculture intelligence","medium","reviewed","official_website","https://agrosmart.com.br/about/","65","8","enrich_or_reclassify_semantic_fit","Semantic confidence medium with margin 7.2; current theme: ag biologicals and crop resilience","medium","medium","Agrosmart is a Brazilian climate-smart agriculture platform providing climate, agronomic, irrigation and ESG intelligence for producers and agrifood corporations. Its products include BoosterAGRO for farm climate/agronomic collaboration, BoosterPRO for climate monitoring and irrigation management, and an ESG platform for risk, sustainability and compliance reporting. It belongs inside BIO VC LATAM as precision-ag and climate-adaptation infrastructure for more resilient, efficient and transparent food production systems."
"semantic_conflict_batch","updairy","Updairy","include","food transition ingredients and proteins","high","reviewed","official_website","https://updairy.co/","56","8.5","enrich_or_reclassify_semantic_fit","Semantic confidence medium with margin 7.5; current theme: agri intelligence and traceable markets","medium","medium","Updairy is a Brazilian food-biotech company producing real dairy proteins without cows through precision fermentation. Its process uses microorganisms, including engineered fungi in bioreactors, to express dairy proteins that can be used as ingredients in dairy, bakery, confectionery, beverages and supplements. It belongs inside BIO VC LATAM as alternative-protein and acellular-agriculture infrastructure for lower-impact dairy ingredients."
"semantic_conflict_batch","waterplan","Waterplan","include","water risk and stewardship intelligence","medium","reviewed","official_website","https://www.waterplan.com/","48","8","enrich_or_reclassify_semantic_fit","Semantic confidence medium with margin 8.4; current theme: ag biologicals and crop resilience","medium","medium","Waterplan is an Argentina/US water-risk and stewardship platform helping water-dependent companies measure, report and respond to site-level water risks using AI and local environmental data. It is not agri-market infrastructure; it should cluster with planetary-boundary water stewardship, climate adaptation and resource-risk intelligence for industrial and watershed systems."
"semantic_conflict_batch","speclab","SpecLab","include","analytical diagnostics and spectral sensing","medium","reviewed","official_website","https://www.speclab.com.br/english.html","68","8","enrich_or_reclassify_semantic_fit","Semantic confidence medium with margin 8.6; current theme: ag biologicals and crop resilience","medium","medium","SpecLab is a Brazilian analytical-technology company using smart spectral fingerprinting, machine learning and chemometrics to digitize complex laboratory analyses with little or no sample preparation. Its platform combines NIR, Raman, X-ray fluorescence, LIBS, custom spectrometers and analytics software to estimate nutritional, chemical, physical and biological properties of materials and products. It belongs inside BIO VC LATAM as analytical diagnostics and quality-control infrastructure for ag, food and biological materials."
"semantic_conflict_batch","beeflow","Beeflow","include","data-driven pollination systems","high","reviewed","official_website","https://www.beeflow.com/about-us","48","8.5","enrich_or_reclassify_semantic_fit","Semantic confidence medium with margin 8.8; current theme: agri intelligence and traceable markets","medium","medium","Beeflow combines crop science, bee biology, data analytics and proprietary bee-nutrition technologies to provide professional pollination services that improve fruit yield and quality. It belongs inside BIO VC LATAM as a biocentric ag-biologicals company: the product is not software alone, but managed biological pollination performance in specialty-crop production."
"semantic_conflict_batch","branch_energy","Branch Energy","include","distributed clean-energy infrastructure","high","reviewed","official_public_profile","https://www.linkedin.com/company/branch-energy","57","8.5","enrich_or_reclassify_semantic_fit","Semantic confidence medium with margin 8.9; current theme: resource recovery and remediation","medium","medium","Branch Energy deploys clean-energy and energy-management infrastructure, including on-site batteries and data analytics, to reduce customer energy costs, increase resilience and lower carbon emissions. It is not biotech, but it fits the broader planetary-boundary perimeter as emissions-reduction and resilience infrastructure for material systems. It should cluster with climate and resource intelligence rather than biofactories or medical devices."
"semantic_conflict_batch","magnamed","Magnamed","include","critical-care medical devices","medium","reviewed","official_website","https://www.inovacoesmagnamed.com.br/company","50","8","enrich_or_reclassify_semantic_fit","Semantic confidence medium with margin 9.4; current theme: clinical diagnostics and medical devices","medium","medium","Magnamed is a Brazilian medtech company specialized in respiratory care, mechanical ventilation and critical-care devices for ICU, emergency and transport use. Its BIO VC LATAM fit is clinical infrastructure: hardware and medical-device manufacturing for human physiology and hospital care. It should cluster with clinical devices, not with materials or food."
"semantic_conflict_batch","inner_cosmos","Inner Cosmos","include","neurotherapeutic medical devices","high","reviewed","official_website","https://innercosmos.ai/","54","8.5","enrich_or_reclassify_semantic_fit","Semantic confidence medium with margin 9.6; current theme: biobased materials and waste valorization","medium","medium","Inner Cosmos is a neurotechnology company developing a minimally invasive embedded brain-computer-interface therapy for treatment-resistant depression. Its Digital Pill is designed to read and stimulate brain networks, with public FDA early-feasibility milestones. It belongs inside BIO VC LATAM as neurotherapeutic medtech: a device-based biological intervention on neural circuits, not generic AI or wellness software."
"semantic_conflict_batch","harmony-biosciences","HARMONY","include","food transition ingredients and proteins","medium","reviewed","external_news_profile","https://web.brinc.io/finding-harmony-in-infant-formula-innovation/","55","8","enrich_or_reclassify_semantic_fit","Semantic confidence medium with margin 9.9; current theme: food ingredients and biofactories","medium","medium","Brazil/US infant-nutrition biotech developing human breastmilk-like formula ingredients through precision fermentation. The company aims to replace cow-milk-based infant formulas with bioidentical human-milk components produced by microbes, improving nutrition while reducing dependence on animal dairy inputs. It belongs inside BIO VC LATAM as a food-biotech and precision-fermentation company in alternative proteins and next-generation infant nutrition."
"semantic_conflict_batch","neocell","Neocell","include","industrial biotech and molecular tools","high","reviewed","official_website","https://neocellbiotech.com/","21","8.5","enrich_or_reclassify_semantic_fit","Semantic confidence medium with margin 10.4; current theme: biomanufacturing and molecular platforms","medium","medium","Empresa biotech enfocada en desarrollo, transferencia y manufactura de biosimilares y biologicos, desde clones y procesos hasta lotes preclinicos y clinicos."
"semantic_conflict_batch","satellogic","Satellogic","include","earth observation and planetary monitoring","high","reviewed","official_website","https://satellogic.com/earth-observation/environment-climate/","57","8.5","enrich_or_reclassify_semantic_fit","Semantic confidence medium with margin 10.8; current theme: resource recovery and remediation","medium","medium","Satellogic operates an Earth-observation platform that provides high-frequency satellite imagery for environmental conservation, restoration, wildfire assessment, climate monitoring and natural-resource protection. It is outside narrow biotech, but inside the broader BIO VC LATAM perimeter as planetary-monitoring infrastructure: a tool for managing ecosystems, land use, climate risks and natural capital. It should cluster with climate and planetary intelligence."
"semantic_conflict_batch","nairotech","Nairotech","include","functional advanced materials and biointerface surfaces","high","reviewed","government_public_profile","https://www.argentina.gob.ar/noticias/disenan-plasticos-con-propiedades-antimicrobianas","71","8.5","enrich_or_reclassify_semantic_fit","Semantic confidence medium with margin 10.9; current theme: biobased materials and waste valorization","medium","medium","Nairotech is an Argentine materials company working with special polymers, composites and nanotechnology, including antimicrobial polyolefin pellets designed to reduce the persistence of viruses, bacteria and fungi on surfaces. The bio signal is not that the material is biobased; it is an advanced-material intervention at the biological interface, with applications in safer surfaces, packaging and industrial substitution. It belongs inside BIO VC LATAM as functional materials with antimicrobial and public-health relevance."
